userid,1,2,3,4,5,target
C-2021-2_U41,"""Learn the concepts and methods of computer science as a basic science, and their importance. They are mainly physical approaches (mainly using mathematical formulas) and CS approaches (methods are mainly algorithmic) for nature. The CS approach can prove the correctness of computational means and the limits of efficiency (on the other hand, the physical approach cannot), and examples of methods such as a quiz are included. Among the fields of basic science, there is computer science, which is the science of properly understanding computation (everything that is done on a computer). A problem is a mathematically rigorously defined function whose answer is uniquely determined for any problem instance x€X, that is, the problem f : If X → Y, the input is x€ If X is the output, f(x) is determined.At this point, if it is too vague, it cannot be a subject of computer science.Here, computation is defined as a given problem case x. It is to find the answer f(x) when the function is calculated.All the computer does is this calculation, but the computer cannot calculate the answer just by being given a problem.The calculation procedure of the function is not taught by humans. The procedure that shows how to calculate this function is called an algorithm.Here, the program is the one that describes the algorithm in terms that the computer understands.The calculation in the computer is a simple (primitive) calculation It can be achieved by combining , where the algorithm should finish the calculation in a finite amount of time, since it cannot take infinite time to calculate, the number of basic operations performed before the algorithm finishes is called the number of calculation steps, and the fewer the calculation steps, the shorter the execution time of the algorithm.
Consider an example algorithm. Suppose there are n coins, one of which is a counterfeit coin with a different weight. At this time, when considering the height of the rooted tree, the height of a ternary tree with at least 3 to the kth power of leaves (the lowest leaf with nothing attached below it) is at least k. Using this, if there are 3 to the power of k coins, the balance will be at least k times.
must use. In other words, if the number of coins is 3 to the (k-1) power + 1 to 3 to the k power, the counterfeit coin can be detected by using the balance k times. , you can see which one is a fake coin.
Euclidean division can then be used to find the greatest common divisor of x and y for some positive integer xy, reducing the number of computation steps and shortening the execution time of the algorithm. ""","""I now know what an algorithm is, and that a computer program is a description of an algorithm in language that a computer can understand. Also, a computer is doing a computation, and that computation is unique to a problem instance. I realized that it was about finding the answer, and the vague image I had of computer calculations became more accurate and clear.""","""I didn't understand the answer to the yes or no quiz at all.""","""Nothing in particular.""","""Today, I was able to tackle some quiz questions, such as finding the wrong coin on the balance, and it was interesting and fun.""",-1
C-2021-2_U42,"""Everything done on a computer is computation, and to control computation you must understand what computation is. The science of understanding computation is computer science. Computer science must give a procedure for calculating the function, and that procedure is called an algorithm.""","""There are two computational approaches, a physical approach and a CS approach. Methods of the physical approach include mathematical formulas, which formulate phenomena based on observations. Algorithms are used in the CS approach. , which formalizes every problem as a function.""",,,"""It was very interesting to learn more about the processing that goes on inside the computer. I've used the word 'computation' a lot in my life, but when I look back at the fundamentals of what it actually is, I made new discoveries and learned a lot. """,-1
C-2021-2_U43,"""There are two approaches, a physical approach and a CS approach. Computer science is a field that can be a basic science. Everything performed by computers is computation, and computer science is necessary to manipulate that computation."" A problem is a mathematically rigorously defined function, and a calculation is to find f(x) given a problem instance x.A procedure that expresses how to calculate a function. is called an algorithm, and it takes a finite amount of time.A program is an algorithm written in a language that computers can understand.You can use rooted trees to solve problems like the Nisecoin problem.""","""I was able to understand the meaning of the word computer science. I was able to understand the relationship between algorithms and programs.""",,,"""The fakecoin issue was a little more difficult.""",-1
C-2021-2_U44,"""In order for a computer to perform calculations, it is necessary to provide it with a procedure or algorithm that indicates the calculation procedure of a function. Also, an algorithm expressed in a language that a computer can understand is called a program.""","""For the problem of finding fake coins, I found out how to derive an algorithm that can be judged with the minimum number of times.""","""I wondered how and when to use rooted trees.""",,"""I've seen the fake coin discovery problem before, but never thought about it in terms of finding algorithms, so it's good to know something new.""",-1
C-2021-2_U46,"""Basically, you can find anomalies in the shortest time by dividing them into three chunks.
You can visualize how many trials are optimal in the rooted tree.""","""You can find anomalies in the shortest steps""",,,,-3
C-2021-2_U47,"""Everything done in a computer is a calculation. A problem is a mathematically rigorously defined function. The flow of calculation → algorithm → programming.""","""I understand the importance of accurately defining the problem.""","""I've heard explanations about netsuke trees before, and even then I didn't feel comfortable with them, but this time they were also difficult.""",,"""Since I am not good at mathematics, I felt that the content of this time was consciously difficult, or rather, I frowned. I could not understand it the first time, so I will take revenge. """,-3
C-2021-2_U48,"""In computer science, we learn about the importance of the concepts and methods of computer science as basic science, and calculate problems using the method of algorithmization. Computer science is the science that understands what computation is. The problem is that the criteria for importance must be clearly defined.Calculations are calculated as mathematically strictly defined functions.The procedure that indicates the calculation method is called an algorithm, a language that computers can understand. An algorithm written in is called a program. The algorithm must complete the calculation in a finite amount of time.""",,,,"""I was impressed that computer science treats every problem as a calculation problem of functions. Until now, when a computer was calculating something, I was curious about how it was calculated. I'm glad I was able to do that.""",-3
C-2021-2_U5,"""A problem is a mathematically rigorously defined function, and calculation is to find the answer f(x) when a problem instance x is given. A computer cannot calculate just by being given a problem. Therefore, it is necessary for humans to indicate the procedure. This is called an algorithm.""","""Computers are not omnipotent, and it is difficult to read situations from texts and formulate them. Human efforts to handle algorithms are necessary.""","""Late understanding of practical examples of specific algorithms using functions.""",,"""When I was in high school, I did a lot of calculations with Excel and programming, but it was an opportunity to look back on it from the perspective of algorithms.""",-3
C-2021-2_U50,,,"""is not
""",,,-3
C-2021-2_U53,"""This time, I learned about computer science, computation and algorithms. I learned a lot about CS approaches, algorithms, etc.""","""I had heard the word ""algorithm"" before, but had no idea what it meant, so I was able to learn about it through this lecture. It was complicated, but once I understood it, I found it very interesting."" I got it.""","""Nothing in particular.""",,"""This lecture was also very interesting. I'm looking forward to next time.""",-3
C-2021-2_U54,"""Everything done on a computer is a calculation. A procedure that shows how to calculate a function is called an algorithm. A rooted tree has depth and height in addition to roots, parents, children, and leaves. The same group If you measure it many times, the height will increase and it will be inefficient.""",,,,"""I got a perfect score on the quiz today, so I'll do my best next time. However, I made two mistakes in the exercises, so I'd like to review them thoroughly. I've heard about the correct meaning of algorithms and programming. I felt like I had a deeper understanding when I learned about it.""",-1
C-2021-2_U55,"""Science has a physical approach and a CS approach. Computer science can be a basic science and has its own theory system. A procedure that shows how to calculate a function is called an algorithm. Algorithm is a language that computers can understand. What you write is the program.""","""I was able to understand the grounds for saying that computer science is a basic science.""","""Not particularly""",,"""I was able to concentrate well in class. I will continue to do my best.""",-1
C-2021-2_U56,"""The physical approach is mainly concerned with nature, but the CS approach is mainly expressed in character strings. Computer science has its own theoretical system, which is as important as physics."" It is a field that can become a basic science. A problem is a mathematically rigorously defined function, and a calculation is to obtain the answer f(x) given a problem instance x. An algorithm is a procedure that describes how to compute a function. A program is an algorithm written in language that a computer can understand. An algorithm for calculating x→y finishes the calculation in a finite amount of time. The problem should be rigorously and clearly stated. The depth of a rooted tree vertex indicates the number of edges that pass from the value to the vertex. The rooted tree height indicates the maximum leaf depth. A ternary tree with 9 or more leaves has a height of at least 2. A ternary tree with 3^k or more leaves has a height of at least k. Therefore, if there are 3^k coins, the balance must be used at least k times. ""","""I was able to understand algorithms, programming, calculations and problem definitions in computer science. I was also able to understand the concept of rooted trees using scales.""","""Nothing in particular""",,"""I was a bit confused about the rooted tree, but overall I think I was able to understand it. I'd like to dig deeper into the rooted tree.""",-2
C-2021-2_U57,"""Computer science is a field that can become an important 'basic science' for designing efficient computational procedures for all kinds of problems, and is a field that is indispensable for dealing well with 'computation'. Since it is defined to be provable, things that are too ambiguous are not subject to calculation. A method called ""rooted tree"" is used to find the shortest route in this calculation process. ""","""Before taking the course, I thought that computer science was not an unrelated field (or at least a field that I was deeply involved in) for me in the Faculty of Pharmaceutical Sciences, but in fact, it can be applied to any experiment and can be the basis of many fields. I knew the problem of measuring the weight of the coin given as an example, so I was able to create a concrete image.""","""I didn't know how to formulate a specific formula, but if I interpret it as ""computer science"" to think about the formula, it is not something that has a conclusion from the beginning like compulsory education. I thought it would be fine. ""","""As I wrote in 3, is it correct to say that coming up with formulas is 'computer science'? ""","""It was good because it was easy to understand as I did last time because there was an example (the problem of measuring the weight of a coin) that gave me a concrete image.""",-2
C-2021-2_U58,"""A program is an algorithm that a computer can understand.
Calculations in computers are realized by combining simple calculations, and this combination is called an algorithm. ""","""When detecting an error by multiplying each bit by n, the larger the n, the higher the certainty of detection, but the amount of information increases.
""","""I didn't understand the last Hamming distance error detection table.""",,"""I had bad side effects from the vaccine, so although I attended, I could hardly participate.
Next week's class will be in good shape and I will participate properly. excuse me. """,-1
C-2021-2_U59,,"""I was able to think about algorithms while thinking about specific problems such as the fake coin problem.""","""It was hard to see the rooted tree.""",,,-2
C-2021-2_U6,"""The word ""calculate"" differs from its usual meaning in computer science, meaning that a number is put into a function and an answer is returned, and the process of calculating that function is called an algorithm. Algorithms must finish their calculations in a finite amount of time. In the balance problem, the height of the rooted tree is the number of trials, and the optimal solution is a binary tree or a ternary tree. ""","""I was able to grasp the meaning of the word ""to calculate"". In addition, I became able to think of the optimal number of trials in the balance problem. ""","""I couldn't quite understand the proof that the optimal solution is a binary tree or a ternary tree.""",,"""I couldn't understand most of it because I couldn't concentrate, so I had to review it with slides and archives. """,-2
C-2021-2_U60,"""Calculations are divided into physical approaches such as mathematical formulas targeting nature, and CS (computer science) approaches that are expressed in character strings by algorithmization.
In CS, ""computation"" is defined as finding the solution f(x) to a mathematically rigorously defined problem x.
On top of that, an algorithm is a procedure for completing a ""computation"" in a finite amount of time.
Rooted trees are useful when looking for algorithms. A rooted tree starts with a single node called the root, connects two nodes with a parent-child relationship with an edge (the one closer to the root is the parent, the one farther from the root is the child), and ends with a leaf that has no offspring.
The depth of a rooted tree node can be expressed by the number of edges that pass through to that node, and the height of a rooted tree is expressed by the maximum leaf depth.
A rooted tree in which the number of children at each node is n or less is called an n-ary tree (n-ary tree) (ex. binary tree, ternary tree)""","""Algorithm definition""","""Coin exercise (I don't know the weight of the fake one)""",,"""Because there is a gap between class and review, I would like to correct this situation.""",0
C-2021-2_U63,,,"""I can't say that I can do the detailed formula of b-1 with confidence.""",,"""Until now, I only knew the word ""algorithm"" from the feel of it, but I'm glad I was able to understand its meaning properly.""",-3
C-2021-2_U64,"""In this class, we learned about computer science. We also learned that calculations in a computer are realized by combining simple calculations, and that this combination is called an algorithm.""","""Everything done by a computer is a calculation, and understanding about that calculation is computer science. A procedure that tells a computer how to calculate a function is called an algorithm, and there are various kinds. I also learned that the program is an algorithm written in a language that computers can understand, and I was able to understand the problem of finding the maximum value.""","""The counterfeit coin finding problem was so difficult that I couldn't understand it.""","""Nothing in particular.""","""I felt that there was a lot of mathematical content that was difficult, so I thought I would review it again and look back. Also, in this class, compared to the previous classes, I lacked an overall understanding, so I prepared a little more. I thought it would have been better if I had done it. Next time, I would like to prepare for the class while paying attention to the details.""",-2
C-2021-2_U65,"""(
Problem: mathematically defined functions (must be exact)
Computation: Obtaining the answer f(x) when a problem instance x is given
Algorithm: A procedure that describes how to compute a function
Program: A description of an algorithm in a form that a computer can understand
Computer Science: The science of understanding computations performed on computers
Computer science approach: Method → ​​Algorithmization
　　　　　　　　　　　　　　　　　　　Make all problems into function calculation problems (expressed as strings)
　　　　　　　　　　　　　　　　　　　　Characteristics) can be proved
Computer science can be a basic science""","""The counterfeit coin problem was interesting. At first, I couldn't think of how to do it three times out of nine, but after listening to the explanation, I felt refreshed.""","""Nothing in particular""","""Nothing in particular""","""Considering that everything in everyday life becomes a problem, I felt that the way I see the world will change a little as I spend my days from now on. I felt that the game-like, troublesome thoughts were just a little fun.""",-1
C-2021-2_U66,"""I learned about what computer calculation is, what the problem is in the first place, and examples of problems. I also thought about the problem of finding fake coins using a rooted tree (algorithm).""","""Computer science is the science of controlling and understanding the computations performed on computers. Algorithms are procedures that describe how functions are calculated.
""",,,"""The example of thinking about what ""calculation"" is and the example of the fake coin discovery problem were easy to understand, but the example of the CS approach was a little difficult to understand. I think I was able to understand the meaning of the phrase. """,-2
C-2021-2_U67,"""There is a physical approach and a CS approach. The former cannot be proved, but the latter can be proved. Computer science is also about learning.Here, calculation is to find the answer to a certain problem.Since computers cannot answer just by giving a problem, it is necessary to teach algorithms .""",,"""The content of the algorithm was difficult to understand.""",,,-1
C-2021-2_U68,"""When you want a computer to do a calculation, you have to tell it how to do it. This algorithm changes the time it takes to do the calculation, and an unwise algorithm can make it impossible."" Therefore, a human must come up with a smart algorithm.""","""The coin problem helped me understand how to find different coins in fewer iterations.""",,,"""In the problem of guessing coins of different weights, it was interesting to note that the number of times the balance was used depends on whether you know whether different coins are heavy or light. This difference depends on the amount of information given at the beginning. thought to occur.""",-3
C-2021-2_U69,"""This information science lecture was about what computation is in a computer and what an algorithm is.""",,,,,-1
C-2021-2_U70,"""The main content of this class is what computation is. Computation can be the foundation of all fields of science and technology. Computation methods include physical phenomena that formulate phenomena based on observations. There are two approaches, one is the computer science (CS) approach that formulates all problems as functions.By combining several of these calculations, we build algorithms and find solutions to various problems. be able to.""","""I learned the basics of programming in the first semester, but now I understand how that programming is constructed and how it is used.""","""I wasn't sure how to read the rooted tree diagram.""",,"""In today's class, I was able to think again about the calculations that underlie the scientific field, and for the first time I was able to understand the definition of calculations that I had been doing all the way through high school.""",-1
C-2021-2_U71,"""From today's lecture, the theme will change and we will learn about ""computation"", especially computer science. And in order to master computation, we need to know what computation is, and in order to know that, science is computer science.""","""Computation, especially in the computer science approach, treats all problems as functional problems. Here, the method of approach uses algorithmization, and in computation, the problem must be described strictly and accurately.""",,,"""The theme changed, and I took a programming class in the first semester, so I hope I can learn while connecting what I learned there with what I will learn in the future.""",-1
C-2021-2_U73,,,,,"""The idea of ​​the algorithm is similar to dividing elements into prime factors, and I thought it could be used in everyday life.""",-3
C-2021-2_U74,"""Computation is so important that it can be said that everything in a computer is made up of calculations.""","""Algorithms can determine many things""",,,"""I had heard about determining the weight of medals once, so I was able to get into the details.""",-2
C-2021-2_U75,"""The physical approach mainly targets nature and the method is mathematical expression, whereas the CS approach expresses all problems in character strings and formalizes them, and uses a method called algorithmization. It is done on a computer. Computer science is the science of computation.If a computer is not given an algorithm, it cannot calculate the answer even if it is given a problem.Algorithm is a procedure that shows how to calculate a function, and it is a combination of simple calculations Yes. An algorithm written so that a computer can understand it is called a program. Using the concept of a rooted tree, it is possible to prove the optimality of an algorithm.""","""It turns out that an algorithm is a procedure that shows how to calculate a function that is essential for a computer. It is important to understand the concept of finding a counterfeit coin with only one coin out of several coins in the minimum number of times. Done.""","""I didn't quite understand how to use rooted trees.""",,"""It was interesting to learn that the algorithm was involved in something like a quiz about finding fake coins. There were parts such as the rooted tree that I didn't understand well, so I would like to review it so that I can understand it. think.""",-2
C-2021-2_U76,"""Computer science is an important foundational science, the discipline of coping with all the computations performed on a computer. Computers must be taught not only problems, but procedures to solve them."" A program that shows the procedure is called an algorithm, and a program is a program that converts the algorithm so that the computer can understand it.""","""If the search engine is too vague, it will not be included in the calculation as it is.""","It was difficult to determine the problem to be solved in Example 2 of Reviewing Examples ``Determine whether the Collatz-Kakutani conjecture is correct''. """,,"""I'm late in filling out the class review sheet, so I'd like to finish it sooner from now on.""",0
C-2021-2_U78,"""A combination of primitive computations is called an algorithm. It is also represented by a rooted tree.""","""I learned how to find the optimal solution and how to find the possibility.""","""I learned how to optimize lighting.""",,"""It's nice to know that rooted trees can be visualized.""",-3
C-2021-2_U79,"""I learned the concept of computer science as a basic science, what kind of fields they are, and learned about their importance.""","""I understand why computer science is said to be the foundation of all scientific fields. Algorithms are procedures that describe how to compute functions.""","""I didn't understand the fake coin discovery problem.""",,,-1
