userid,1,2,3,4,5,target
C-2021-2_U1,"""Algorithms define the methods of calculation performed on computers. Algorithms are functions that solve problems in a finite amount of time by repeating simple calculations. An example is an algorithm that repeats comparisons. ""","""We found that it is possible to calculate with a small number of comparisons by devising grouping.""","""It was written that algorithm A is optimal because it can be judged in k iterations, but I was not sure if there was a general index for judging whether an algorithm was optimal.""",,"""It's getting a little difficult to think about, so I want to prepare well and hope.""",-3
C-2021-2_U10,"""Everything that is done on a computer is a calculation, and in order to make good use of it, it is necessary to understand calculation.Algorithms are procedures that show how functions are calculated.Algorithms are also understood by computers."" A program is a thing written in words that can be written.""","""I learned that many things in this world are performed or observed through computation. I also understood the meaning and general mechanism of algorithms and programs.""","""is not.""",,"""When I learned that a program expresses the mechanism of calculation, I was once again surprised by the tremendous amount of calculations performed on a computer.""",0
C-2021-2_U100,"""The science of understanding who is ""computation"" is called computer science, and the problem is that the answer is uniquely determined for any problem instance, It is an understanding of what the calculation of a fixed thing looks like. Also, a procedure indicating a calculation method is called an algorithm. ""","""I understood why computer science existed, so I understood more about the significance of information science. Also, I knew algorithms that weren't programs, but what was the algorithm on the computer? I was able to understand why.""",,,"""It was a very interesting class because I learned about programs, algorithms, and the relationship between computer science, and I could understand why information science is necessary.""",-1
C-2021-2_U101,"""Computation is the foundation of all computer science. To make computation efficient and to control it well, we need to understand what computation is. What we put in is what we output."" In order to do so, we need a problem that is a mathematically strictly defined function, and the answer must be uniquely determined when an arbitrary problem case is input.A procedure that shows how to calculate a function is called an algorithm. , the algorithm must be a finite procedure that can uniquely lead to the answer. The best algorithm is one that takes log_3n times to find a counterfeit coin out of n coins.""","""Today, I learned the importance of algorithms that tell computers how to perform calculations. I learned that problems must be described precisely and clearly. I learned that the level of calculation varies, and I also understood the concept of optimizing the algorithm.""","""Nothing in particular.""",,"""This time, more specific procedures were presented than ever before, so it was easy to understand. What I found interesting was that even if the conditions were ambiguous enough for a human to judge, they could not be calculated using a computer. I realized again that the quality of information required for human communication and the quality of information required for computers are different.
This time, I was able to understand most of the contents in preparation, so the class became more like a confirmation, and I think I was able to understand the contents more reliably. I would like to continue my preparation and review in the future to make my knowledge more reliable. """,-1
C-2021-2_U102,"""In this lecture, I learned about computer science and algorithms of computer calculations.""","""I learned that the algorithms necessary for computer calculations are created by combining simple four arithmetic operations. Programs are used in that process.""",,,"""From this lecture, I learned more about programming, so I felt that it was more interesting than ever. I want to continue learning more.""",0
C-2021-2_U103,"""Computer science is an important scientific field that deals with computation. Computation in computer science is achieved by combining simple computations, and this combination is called an algorithm. When thinking about algorithms, we use concepts such as rooted trees. I have something to do.""","""I realized the importance of the algorithm itself that can communicate to the computer and the importance of setting the correct and useful algorithm to make the best use of the computer.""",,,"""I was absent from this class, so I will write about it later after watching the lecture video. I apologize for not being able to attend the class.""",-1
C-2021-2_U104,"""Calculating with a computer means combining calculations, and that combination is called an algorithm. It is very important to make the algorithm efficient.""",,"""The algorithm for calculating X → Y was difficult to explain mathematically.""",,"""It was interesting because it was like a puzzle to explain how to use algorithms to find fake coins.""",0
C-2021-2_U105,"""We talked about computer science. This is a field that can be a basic science like physics. Algorithms are important to computers. Algorithms are procedures that describe how to compute functions. A program is an algorithm written in language that a computer can understand.""","""I learned about the importance of algorithms. At first glance, computers are much better than humans and look perfect, but I learned that without algorithms, nothing can be done. I learned that algorithms can calculate maximum values, etc. also learned.""",,,"""I found it interesting that calculations required things that the human mind could not do in one go. By thinking about algorithms, it seems that various complex things can be programmed. I thought it could be used in the field.""",-1
C-2021-2_U106,"""What are physical approaches and CS approaches, computer science, definitions of computation, algorithms, properties of univariate integer polynomials, how to solve maximum problems, algorithms using rooted trees, optimality, etc. I learned about","""I was able to learn that the mechanism and background of the problem that I learned in elementary school, 'Find as few counterfeit coins as possible using a balance,' comes from calculations performed by computers. ""","""I didn't really understand how to draw a rooted tree when solving the problem of the optimal solution, so I would like to review it properly.""",,"""I had heard about today's algorithmic problems and optimal solution problems when I was a student or junior high school student, but it was interesting to know the background and mechanism of them now.""",-1
C-2021-2_U107,"""How to handle functions when a computer performs calculations and how to shorten the calculation time when specifying the calculation method""","""Even when specifying the calculation method, it was found that it was necessary to devise ways to reduce the number of candidates as much as possible by avoiding substituting every number. Also, similar measures were necessary to reduce the number of calculation trials. I knew it was.""",,,"""Computers can perform high-speed calculations, but they cannot invent their own calculation methods, so we learned that it is necessary for people who specify calculation methods in advance to be creative. With artificial intelligence, calculation methods are learned while progressing. I thought it might be possible to optimize the",-1
C-2021-2_U108,"""A computer science approach is indispensable for inputting and outputting information. To do this, we use algorithms to formulate problems in everyday life as computational problems, and clarify the criteria for the importance of problems. You have to define it, and then you learn how to evaluate whether the algorithm is valid or not.""",,,"""Why does using a ternary tree work well for balances? I don't know why I used '3'. """,""" This time, a quiz about the optimal algorithm for identifying counterfeit coins was given, and I was able to think about the answer while having fun. I could actually apply it to these familiar things, realize its usefulness, and make use of it in my daily life. I felt like I might.""",0
C-2021-2_U109,,"""Through the work of calculation, I was able to understand what computers can and cannot do.""",,,"""I understood the basic concept of programming very well. I knew the result of the coin problem because it is famous, but it was the first time I touched on an explanation using trees.""",-1
C-2021-2_U11,"""Everything done on a computer is a calculation, and algorithms are what enable a computer to do that calculation.
Algorithms should finish in finite time
n algorithm to find counterfeit coins, maximizing this integer
About Rooted Trees""","""Minimum number of measurements algorithm to find fake coins, finding the maximum value among n integers
The minimum number of times to spot a fake coin is calculated using log""",,"""I would like to know if rooted trees can be used for algorithms other than balance-based algorithms.""","""It was easy to understand by thinking about algorithms in a way that is actually easy to think about.""",-1
C-2021-2_U111,,"""Looking at various examples, I realized that there are various algorithms for different problems.""",,,,-1
C-2021-2_U112,"""Computation is the foundation of all science and technology. It is the process of finding the answer to a problem that is a mathematically rigorously defined function. A function is an input that produces a unique output. Everything done in a computer is a calculation, a combination of simple calculations.The procedure that tells the computer how to calculate a function is called an algorithm, and it completes the calculation in a finite amount of time. , the description of the algorithm is called a program.""","""I was able to learn how computers perform calculations through various examples. I learned that computers organize information by performing various calculations by combining simple calculations. I was able to understand the usefulness of using logarithms to find the number of counterfeit coins, as a means of minimizing the number of times when measuring with a balance.""","""Since this is the first time I've seen rooted trees, there are many things I'm unfamiliar with, such as the meaning of the diagrams and the way of thinking about them, and it took me a while to understand them.","""Nothing in particular.""","""I was able to think about the concept of computation in a broader sense than the image I had of computation until now. Even if it seems easy, I have to devise how to make the computer judge it. I found the point difficult, but at the same time I was interested.The problem of finding a counterfeit coin by weighing a coin in as few times as possible was interesting.By using logarithm, the number of times of weighing the balance was greater than I had imagined. I was surprised at how little was needed and found it interesting.""",-1
C-2021-2_U113,"""About Calculations, Algorithms, and Programs""","""Algorithm for finding the maximum value using a balance.""","""This time it was a new content, so there is nothing in particular.""","""Nothing in particular.""","""This time, we started something new. I thought computers were smarter than us, but I was surprised that they made mistakes when they didn't strictly decide the problems and calculation methods.""",-2
C-2021-2_U114,"""An algorithm is a method of computing a function. An algorithm cannot be called correct if it requires an infinite number of trials, and must end in a finite amount of time. In a rooted tree, the depth of a vertex The height is the number of edges taken from the root to reach its vertex, and the height of the rooted tree is the maximum leaf depth. We call it a tree, or an n-ary tree.""","""I learned that the 'problems' that I had touched on in classes and other things up until now had a very narrow definition, but they also have a broader meaning. I knew how to find a counterfeit coin without using a balance as much as possible in the case of 9 coins, but I could understand it in more detail. ""","""None.""",,"""Several puzzle-solving quizzes using laws came out, and I was surprised because I didn't expect it to lead to the calculations performed inside the computer. I enjoyed listening to the lecture again this time. I'm glad I was able to.""",-2
C-2021-2_U115,"""● CS is not from a specific field　● Everything can be considered as a calculation　● A problem is a function that receives input, processes it, and outputs something　※The answer is uniquely determined
● The calculation procedure is called an algorithm * It must be clearly described and completed in a finite amount of time ● Describe the problem strictly and clearly ● Root parent child leaf k = log3n""","""● Maximum value problem　Use the scale once to reduce the number of integers by one●Clarify the problem and make it a function""",,,"""I thought it was similar to economics in that it turned problems into functions. I felt that setting standards and quantifying invisible things lacked credibility.""",-1
C-2021-2_U116,"""Everything that happens on a computer is based on calculations, and computer science is the science for understanding those calculations. Computer calculations are made by combining simple calculations, and algorithms are used to combine these calculations. It says.""","""I understand the principle that the shortest way to find a fake coin can be found using log3n.""","""I was a little confused about the example algorithm.""",,"""I've heard the word ""algorithm"" often, but I didn't know what it was, so I'm glad I found out.""",-1
C-2021-2_U117,"""Computation has a physical approach and a CS approach, and part of the latter approach is an algorithm. However, the problem computed by a computer must be mathematically rigorous. Computation on a computer is not a simple computation. The algorithm is this combination method.The algorithm finishes the calculation in a finite time.Among them, the one written in the language that the computer can understand is called a program.To prove whether the algorithm is the optimal solution is useful in the notion of a rooted tree, which tells us that, for example, to find a counterfeit coin among 3^k coins, the balance must be used at least k times.""","""In the first place, I was able to understand what calculation in a computer is. When a problem is given, a computer performs calculations using algorithms. I learned that addition and subtraction that we have been doing up to now are not the only calculations. , I was able to understand the technique of rooted trees.""","""In the example in class, I found out that the algorithm finishes the calculation in a finite amount of time, but I didn't understand whether it can be said in general.""","""Isn't there any other way than the improved successive substitution method?""","""The example of the CS approach was difficult and I didn't understand it at all, but it was interesting. I had heard the word ""algorithm"" many times before, but for the first time I was able to understand the proper meaning of the word. For example, when I didn't know the rooted tree method, I wasn't sure if it was the minimum number of times, so I'm glad I learned something new. want to go.""",-2
C-2021-2_U118,"""There is a physical approach that formulates phenomena based on observations by formulating them, and a CS approach that formulates all problems as computational problems of functions by algorithmization. Computation is a problem (mathematically strictly defined It is to seek the answer when given a function","""By the algorithm, the maximum of n values ​​can be found by using the comparator n-1 times.""","""I didn't understand how to prove the optimality of algorithms, so I want to review it.""","""Nothing in particular.""","""There were questions that were relatively difficult for me to think about, such as the counterfeit coin detector, but it was fun listening to the teacher's explanations and thinking about them. sea ​​bream.""",0
C-2021-2_U119,"""I learned about what computer science is, about algorithms (with the example of determining the weight of a coin, Euclidean division, etc.), about the relationship between information and computation.""","""I was able to understand the principle of how heavy coins can be distinguished in a small number of times using a scale.""",,,"""I was amazed when I learned that computer science is the foundation of all science and technology fields. I'm not a mechanical person, so I haven't had many opportunities to touch a computer, and I don't know much about the details. However, I thought that it would be active now in the IT era.""",-1
C-2021-2_U120,"""Computer operations correspond to calculations. The idea of ​​a rooted tree is effective in finding a single fake coin.""","""Distinguishing Largeness and Smallness Using Comparators, Using Scales to Find Counterfeit Coins""","""Thinking about algorithms actually.""",,"""I found it difficult to think of an algorithm using the binary tree of the exercise. I think I still don't understand it.""",0
C-2021-2_U121,"""I was able to learn that everything done on a computer is a calculation, what a calculation is in the first place, and what a problem is. Furthermore, I was able to learn how to calculate a problem function. As a result, I was able to learn about algorithms.""","""I was able to understand that a problem is a mathematically rigorously defined function, and the concept of algorithms. I was also able to understand examples of algorithms using balances.""",,,,-2
C-2021-2_U122,"""Computational and computer science as a basic science form the basis of all scientific and technological fields.
A procedure that indicates how to calculate a function is called an algorithm.","""The Importance of Computation, Computer Science""",,,"""Examples of the CS approach and the fake coin problem never occurred to me.""",-3
C-2021-2_U124,"""About computer science
About the algorithm
""","""I was able to understand the idea of ​​algorithms.""","""I had a hard time solving the problem. I couldn't immediately understand what was written.""",,"""I'm looking forward to a new theme from this time.""",-3
C-2021-2_U125,"""On the essence of information science. (It is a discipline that understands and controls computation.) To understand algorithms, which are the procedures that describe the computation of functions.""","""About the algorithm to find the maximum value from multiple aggregates. The example of finding fake coins was very easy to understand.""","""Description of rooted trees. (Distinction between binary and ternary trees.)
A description of the ""correct"" algorithm. """,,"""Overall, it was difficult and I couldn't understand it. Explaining the correct algorithm was especially difficult, and I didn't know the criteria for whether it was calculating correctly or not.""",-2
C-2021-2_U126,"""This time, I thought about calculation as basic chemistry. Computer science can be considered to be the foundation of all scientific and technological fields. There is an OS approach.Everything that is done on a computer is ""computation"", and computer science is the science for understanding and utilizing this. Algorithms are procedures that indicate how functions are calculated by a computer. """,,,,"""I was able to understand what an 'algorithm' is. Also, I found it interesting because I had hardly seen the view of computation as computational geometry. """,-1
C-2021-2_U128,,,"""This time, there was nothing I didn't understand in the explanation, but the theorem used in the improved successive substitution method made me wonder, 'Why does this happen?' """,,,-1
C-2021-2_U129,"""I learned the concept of computer science as a basic science. It is important to formulate a problem and design an efficient procedure to solve it, which is called a CS approach, not a physical approach based on observation. I also learned about what computation is and what problems are in the first place, and thought of algorithms.""",,,,"""It was difficult to prove the optimality of the algorithm for detecting fake coins, but I'm glad I was able to understand it.""",0
C-2021-2_U13,"""The physical approach and the computer science approach are different. The former finds certain laws by observing nature. Therefore, the laws cannot be proved to be completely correct.
On the other hand, the CS approach formalizes the problem as a computational problem of a function and designs an efficient computational procedure. The correctness and limitations of the computational procedure can be proved.
In CS, the method of calculation is called an algorithm, and the program is written in a form that can be understood by a computer. ""","""I learned the definition of 'algorithm', a word I've heard a lot but didn't know what it was.
I also learned why computers are said to be mathematics. ""","""I couldn't solve the fake coin finding problem myself.""",,,-3
C-2021-2_U130,"""I learned about the definition of computation, which is the basis of work done on a computer, its relation to problems, and the algorithms involved in computation.""","""The idea of ​​the algorithm was explained using detailed examples, so I think I was able to understand the content of the slides.",,,"""I've heard the term before, but I didn't know much about the details, so this class made me realize the necessity of algorithms in computers. I want to make use of it in my future classes.""",0
C-2021-2_U131,,"""Having heard of the counterfeit coin detection problem, I now have a solid understanding of how to find a counterfeit coin from 9 coins with only two weighings.""",,,,-2
C-2021-2_U132,"""computer science""","""All computer work is done with calculations""","""I didn't understand the algorithm very well.""",,"""It's become a mathematical field such as calculation, so I don't really understand it.""",-1
C-2021-2_U133,"""I learned about computing in computers. I learned about computing with algorithms.""","""I was able to understand that computer science is a field that will become an important basic science, and that it will be necessary in the future. Computers cannot calculate given problems, but by demonstrating how to calculate functions, they will be able to do so. I found out it would.""","""It was hard to understand the difference between an algorithm and a program.""",,"""I was able to learn about calculations. I was able to deepen my understanding through examples. I would like to do the exercises, review them thoroughly, and understand the algorithms.""",-2
C-2021-2_U136,"""Algorithms are procedures. Rooted tree methods.""","""I just found out that it's possible to find a tree diagram of how to find a fake coin.""","""Nothing in particular.""","""Nothing in particular.""","""I have solved the fake coin problem before, and I didn't know the model answer at that time, but thanks to this class, I felt refreshed.""",-1
C-2021-2_U137,"""Everything that is done on a computer is a calculation, and this calculation is made up of algorithms. Creating algorithms and enabling computers to perform calculations is called programming.""","""Until now, I had heard the word ""algorithm"" but didn't know what it meant, but through this lecture, I learned that an algorithm is a procedure for calculating a function that leads to the answer to a problem. I was also able to understand the relationship between rooted leaves and optimality.""","""I don't know how to know when to use a binary tree, ternary tree, or n-ary tree for what kind of problem.""","""Will the time come when AI can program?""","""I had solved the problem of fake coins in a quiz, but I had never thought about it based on an algorithmic theory, so I learned something. Also, when calculating with Excel, etc., complicated programming is involved. I was really grateful to be able to realize that this is being used and to be able to enjoy that technology.""",-2
C-2021-2_U139,"""Computer science is a field that can be an important basic science, and can express various information using algorithms and calculations.""","""I understood what an algorithm is and the importance of computation in information.""",,,"""I knew more or less about algorithms, but it was nice to learn more.""",-1
C-2021-2_U14,"""Computer science approach uses algorithmization as a method to design efficient computational means for solving problems. Algorithm is to realize a computational procedure by combining simple and primitive computations. It must be something that can be completed in a finite amount of time.""","""In the computer science approach, we take algorithms as a means, and we found that by properly designing algorithms, we can achieve good performance and efficient use.""","""I didn't really understand the difference between parent and child, so I thought I'd look it up myself.""",,"""I had heard the word algorithm before, but I learned about its meaning and content for the first time in today's class. rice field.""",-1
C-2021-2_U140,"""Algorithm that uses Euclidean division method. Bubble sort is to sort in ascending order. Selection sort is to replace the largest element with the last element. Order notation to think in much larger numbers.""","""Method of Euclidean Algorithm. Meaning of bubble sort and selection sort.""","""I didn't understand why it's better to use an upper bound for order evaluation.""","""Nothing in particular.""","""It was a meaningful lecture because I was able to understand why the Euclidean mutual division method, which I learned in high school, holds true.""",-3
