userid,1,2,3,4,5,target
C-2022-1_U4,"""There is computer science to understand what 'computation' is. A procedure that indicates how to calculate a function is called an algorithm, and a program is what makes a computer understand it. Thinking about rooted trees sometimes makes it easier to think of algorithms. ""","""I was able to understand the correct meaning of algorithms. I learned that calculations and algorithms do not have to take time, but must be completed within a finite amount of time.""",,,"""I thought it was important to think about how to calculate with fewer steps. It is interesting to understand how to distinguish fake coins from among many coins. I felt.""",-3
C-2022-1_U42,"""・Physical approach, CS approach
・Algorithms and examples""","""The physical approach is to formulate phenomena based on observations. However, since it is strictly based on observations, it is not possible to prove whether the laws are correct. On the other hand, formalizing all problems as calculation problems of functions. is called the CS approach, which can prove the correctness of the calculation procedure and the limits of efficiency.
・Algorithm is a procedure that shows how to calculate a function. In other words, it is a procedure of calculation.
・For example, there are things such as comparing sizes and finding the greatest common divisor.
・When finding the greatest common divisor, divide these two numbers by the smaller one of any two numbers. If the remainders of the two numbers are both 0, answer.If not, subtract 1 from the smaller number and start over. There is a solution called naive-gcd. But this method is time consuming. Consider filling a rectangle with a square. If the remainder of the division of the long side by the short side is 0, then the short side is gcd. """,,,"""I got the impression that the content of the class was quite different from what I had learned in A. However, when comparing the size of a coin using a scale, instead of just comparing two different coins, the overall content is 3. If you ask me how to compare problems after equal division and how to find the greatest common divisor by exhaustive solution or Euclid's method of mutual division, it seems that this is certainly faster and easier to find. I was very interested in learning new ideas by learning calculations in the world of information.""",-3
C-2022-1_U44,"""I learned roughly how information and computation are related and how they work.""","""Algorithms are used ingeniously with logs and prime numbers.""",,,"""I think there will be more and more complicated content, so I want to study hard.""",-3
C-2022-1_U45,,,,"""Nothing in particular.""",,-3
C-2022-1_U46,"""Computer calculations can be realized by combining simple (primitive) calculations
・Algorithm: How to combine calculations, calculation procedure
・Program...It is an algorithm written in language that a computer can understand.","""I found the Euclidean algorithm expressed as a mod expression""",,"""Nothing in particular""","""I wasn't as focused as usual today, so I'll focus next time.""",-3
C-2022-1_U47,"""I learned about computer science and algorithms.""",,,,,-3
C-2022-1_U48,"""Computation in information science can be the foundation of all scientific and technological fields. Among them, there is a physical approach that mainly deals with nature and a CS approach that mainly expresses character strings. Science is the science of trying to understand what computation is, and it is a field that can be a basic science like physics, etc. Algorithms are like programs in a computer.""",,,,,-3
C-2022-1_U49,"""Computation has a physical approach and a computer science approach. Computation is to find the answer when only one problem case is given, and the procedure is called an algorithm. Also, the procedure can be completed in a finite time. There must be.""","""Computational problems need to be rigorously articulated. In the fakecoin discovery problem, the rooted tree tells us at least how many times the balance must be used.
The number of times the balance is used can be greatly reduced by using the optimal one, which saves time. ""","""I had trouble figuring out how to calculate the number of times when I didn't know if the fake coin was heavy or light.""",,"""It was interesting to think about the number of times the balance was used.""",-3
C-2022-1_U5,,"""I was able to understand a little bit of what I didn't understand when talking about algorithmic coins and ternary trees.""",,,,-2
C-2022-1_U51,"""Algorithm is a method of calculation, and a program is written into a computer.""","""The balance problem is completely different in difficulty depending on whether or not the one thing that is different is whether it is heavy or light.""","""I didn't understand much about binary and ternary trees""",,"""I missed the quiz because I was late, so I'll be more careful next time.""",-3
C-2022-1_U52,"""Separate information. Everything done on a computer is a 'computation'. Computer science is the study of how to perform these calculations well. Calculations in computers can be realized by combining simple calculations. This combination is called an algorithm. A program is an algorithm written in language that a computer can understand. ""","""We found that the processing time differs depending on the calculation method.""",,,,-3
C-2022-1_U53,,,,,"""The definition of 'calculation' by programming was different from what I imagined when I saw an example of 100-digit pi copying, and it felt strange. """,-3
C-2022-1_U54,,"""When thinking about a problem, we have to think about whether the calculation will be completed properly, whether the problem is specific and whether the answer will be unique.""",,,,-3
C-2022-1_U56,,,,,"""Through the exercise of separating coins using a binary tree, I was glad that I was able to understand the algorithm for separating coins efficiently and reliably. I was surprised to find detailed definitions for words that we take for granted, such as calculations and problems. """,-3
C-2022-1_U58,,,,"""Regarding the previous submission of the BR-Map. I submitted it around 8:00 am on May 9th. At that time, it was displayed as submitted, but when I checked again today, it was not submitted. The upload went well. If the image file has not arrived, I would like to submit it again regardless of the grade, but where can I submit it?
postscript
I've attached a shared link from Google Drive. I'm very sorry for the inconvenience.
https://drive.google.com/file/d/1tXHepn1OfkknLzz7IG_-77lD-9Tq-Rt8""",,-3
C-2022-1_U6,,"""Algorithms can be applied to a variety of problems, and when dealing with these, we found it necessary to improve efficiency and think about calculation methods.
I could understand how the algorithm works from the rooted tree.
It turns out that Euclid's Algorithm can be used in the algorithm. ""","""I was a little skeptical that computer observation would be a physical approach, but it may not matter much because it is important to be able to prove the phenomenon.""",,"""The search engine came up in class, and I was so impressed to learn that this algorithm is used in the system that often comes up with articles containing search words when searching on Google. Last class. So I overlooked that single substitution ciphers are included in symmetric key ciphers, so I thought I'd be careful.""",-3
C-2022-1_U61,"""How to use a computer to make it easier""","""A computer cannot compute an answer just by being given a problem.
""",,,"""Just hearing the word computer science made me feel excited.""",-3
C-2022-1_U62,,"""In order to solve a problem efficiently, it is necessary to derive the optimal algorithm""","""What is an Algorithm""",,,-3
C-2022-1_U63,,,,,"""I thought that thinking about the optimal algorithm is a way of thinking that is necessary to efficiently proceed with things in everyday life.""",-3
C-2022-1_U64,,,"""On properties of single-variable integer polynomials""",,"""I had heard about algorithms, but I didn't know much about them, so it was interesting.
I understood very well that the problem had to be well defined. """,-3
C-2022-1_U65,"""Physical approach is to formulate phenomena based on ""observation"", and it is not possible to prove that the law is correct. In addition, formalizing all problems as calculation problems of functions is called the CS approach.
A problem is a mathematically rigorously defined function, and a calculation is to obtain the answer f(x) given a problem instance x.
Computers need to be taught by theorizing the calculation procedures of functions, even if humans can understand them just by looking at problems. A procedure (procedure of calculation) indicating the calculation method is called an algorithm. Programming is the explanation of algorithms in terms that computers can understand.
For example, in the algorithm for finding the maximum value, we can find the maximum value by using a comparator twice with three integers. Even if the number increases, the maximum value can be obtained by using the comparator n-1 times for n integers. When considering whether the obtained algorithm is optimal, consider using something like a tree diagram called a rooted tree.
""",,"""I couldn't understand the rooted tree of the algorithm well just by looking at the diagram and listening to the story, so I'm going to review it by doing some examples myself.""",,"""I was able to learn about computer calculations from the definition of problems, and it was a good opportunity to reconsider what the problems that I had solved so far were. Also, to solve the problems as fast as possible with a computer, Euclid's Algorithm of Algorithm When I learned that I could use , I realized once again that what I had learned was useful in a place like this.""",-3
C-2022-1_U66,"""Computer science is computer science as a basic science, and it can be the foundation of all scientific and technological fields, and it is a field that can become an important basic science like physics.
Computers are not just convenient tools that are used by specialists in other fields, but they have their own theoretical system behind them, just like other academic fields.
Computer science is the study of understanding what computation is, in order to interact with it and control it.
A problem in computer science is a mathematically rigorously defined function, and it is premised that the answer to any problem case is uniquely determined. Therefore, the problem should be rigorously and clearly stated. Calculation is to find the answer to the problem. However, since a computer cannot calculate an answer just by being given a problem, it needs to be taught by a human being how to calculate the function, and the procedure that shows how to calculate the function is called an algorithm. A program is an algorithm written in a language that a computer can understand. Algorithms finish their calculations in a finite amount of time.
By devising the algorithm, the number of calculation steps can be reduced, and the execution time of the algorithm can be shortened. """,,,,"""We usually use computers casually, but in order for computers to solve problems, we actually need to teach them step-by-step calculation procedures, and I thought it would be difficult to build an algorithm.""",-3
C-2022-1_U67,"""Computation, what is a problem, from a computer science perspective. Also, for computational examples.""","""I now know the minimum number of steps required to find the maximum value out of n. I also remembered Euclid's Algorithm.""","""I almost understood.""","""Nothing in particular.""","""The processing power of personal computers is incredibly fast and accurate compared to humans, but I realized that an efficient method is needed to process a huge amount of information. I know, it was fun.""",-3
C-2022-1_U68,,"""In the counterfeit coin detection problem, the algorithm can find counterfeit coins by the number of times the balance is used. It can be expressed as k=log3(n).""","""I was satisfied with the answer to the quiz with examples of CS approaches, but I couldn't solve it myself.""",,"""It was hard because I had only prepared for one lesson. From next time, I will make sure to check the range and prepare for it. Knew.""",-3
C-2022-1_U69,"""Everything done on a computer is 'calculation', but a computer cannot calculate an answer just by being given a problem. So we have to write algorithms (procedures that tell us how to compute a function). At that time, it is required to reduce the number of calculation steps (the number of basic operations performed until the algorithm ends) by devising the algorithm as much as possible. ""","""I learned how to give algorithms to solve the problem of finding the maximum value, the problem of finding a counterfeit coin, and the greatest common divisor problem.""","""I couldn't understand the exhaustive solution method just by listening to the explanation once in class, so I want to review it.""",,,-3
C-2022-1_U7,"""Calculation has a physical approach that formulates it and a CS approach that formulates it as an algorithm. Since the CS approach calculates functions, it can be proved. By using rooted trees, it can be completed in a finite time. You can do calculations that can","""It's not realistic to do calculations that require a huge amount of time.""","""I still didn't quite understand the definition of the algorithm.""","""Nothing in particular.""","""I learned that y is uniquely determined when x is determined, which is the property of the function. It was interesting to talk about the coin example.""",-3
C-2022-1_U70,,,,"""Not particularly""",,-3
C-2022-1_U71,"""Mechanisms and methods of computer thinking""","""By improving the algorithm, the number of trials can be dramatically reduced. The calculation is done by having the computer solve the problem mathematically. It's not impossible even if it's exhaustive, but if the amount increases, it will be enormous. It takes a lot of time, but there are systems that use it (RSA encryption, etc.)""",,,,-3
C-2022-1_U72,,"""A problem is a mathematically rigorously defined function, and a calculation is to find the answer f(x) given a problem instance x. Show how to calculate the function. The procedure is called an algorithm.""",,,,-3
C-2022-1_U73,"""Computation can be divided into a physical approach, where nature is the object, and a CS approach, which is expressed mainly in character strings. It's computer science. A problem is a strictly defined function, and the answer must be fixed for any problem case. A combination of simple calculations is called an algorithm. The number of calculation steps is the number of basic operations performed before the algorithm terminates. A program is an algorithm written in language that a computer can understand. Rooted tree height is the maximum tooth depth. ""","""CS = computer science. I could imagine that everything done on a computer is a calculation. I understood the problem of finding fake coins and it was interesting.
Say that a ternary tree with nine or more leaves has a height of at least 2. It is easy to understand if the balance is regarded as an internal node in Algorithm A.
The physical approach cannot be proved, but the CS approach can be proven. Euclidean division using rectangles. Repeated updates of y and x should always be less than half of their original values.
""",,,,-3
C-2022-1_U75,"""The CS approach formulates all problems as calculation problems of functions. This method is called an algorithm. There is a problem such as how many times a coin can be selected using a balance.""","""I understand the meaning of new words.""","""The math on how to distinguish coins of different weights was confusing.""",,"""Since I entered a new field, there were some difficult words, but I want to do my best from now on.""",-3
C-2022-1_U76,"""What happens inside a computer. What is an algorithm?""","""Algorithms can make a big difference in computational efficiency.""","""I wanted to know the connection between computation and practical mechanisms.""",,,-3
C-2022-1_U78,"""Computation is to find f(x) for a function that is strictly defined mathematically, given an example x. ).The program that describes it.""","""Using Euclid's Algorithm, I was able to find the greatest common divisor and the number of remainder calculations.""","""Use the idea of ​​rooted trees to find an algorithm that solves a problem with the minimum number of computational steps.""",,"""I felt that in order to find the optimal algorithm, it is important to use your brain flexibly, as in the case of difficult problems for elementary school students.""",-3
C-2022-1_U79,"""Calculation is to find an answer with a function that has only one output answer for a certain input. It is important to accurately create a problem that is a function in order to have the necessary content calculated. An algorithm is a method of calculating a function.It is desirable that the algorithm be completed in a finite amount of time, and that the calculation should be completed in as short a time as possible.In class, we used the example of judging counterfeit coins.""","""I found that the problem had to be rigorous in order for the computer to always output the answer it needed. I realized that it's no good if the calculation doesn't end properly.""",,,,-3
C-2022-1_U80,"""About algorithms Algorithms are procedures and calculation methods for solving problems
Algorithmic gymnastics repeats the same procedure! ! ! ""","""There is a big difference between a program that finds pi and a program that memorizes the answer and a program that calculates pi.
It was interesting because there was something in common with the study of the students. ""","""What is CS?""",,,-3
C-2022-1_U81,"""Computer Science and Computation""","""What is Computation?""",,,"""It was easy to understand.""",-3
C-2022-1_U82,"""Computer science (computer science) is the basis of all science and technology fields. It is possible to represent all problems with calculations (character strings) and prove the correctness of the calculation procedure and the limits of efficiency. A feature of the CS approach is to generalize and abstract the problem.Calculation is to be able to find the answer to a certain problem instance.In order to calculate the function , A procedure that indicates the calculation method must be performed (algorithm).Algorithms written in language that computers can understand are called programs.A correct algorithm must complete the calculation within a finite amount of time.The maximum value problem or When creating an algorithm for the counterfeit coin problem, it is a good idea to be careful to conduct examinations in as few rounds as possible.(Up to B-1,4)""","""I was able to understand what computer science is like. I've heard the words algorithm and program, but today's lecture made me understand what they mean. Especially in the problem of finding fake coins, I found the process of working based on 3 to be interesting.""","""I found it difficult at first because there were a lot of letters in the preparation stage. I was able to understand the algorithm by looking at the example, but I thought it would be difficult to create an efficient algorithm by myself.""",,,-3
C-2022-1_U83,"""Computer science is the science of controlling computation""","""Computers can only do calculations, so they are combined into programs.""","""I didn't quite understand how many coins to distribute""",,"""I found it useful to combine calculations""",-3
C-2022-1_U84,,"""I understood the outline of the CS approach.
Computer calculations are completely different from our human thinking circuits, so they cannot answer questions with ambiguous questions. """,,,"""Computers' calculation methods are completely different from those of humans, and
I found it difficult to understand and implement when I did. """,-3
C-2022-1_U85,"""Computer Science, About Algorithms""","""Calculations are important!
Euclidean Algorithm""","""When to use math""",,"""Since I entered 'B' today, I want to refresh my mind and review what I learned up until the last time. """,-3
C-2022-1_U86,"""About Machine Calculation""","""Some calculations take longer than a person's lifespan.""",,,,-3
C-2022-1_U87,"""In today's lecture, we learned about calculations and algorithms. In class, we were investigating how many operations are necessary to discover fake coins, but by studying the concept of optimization, we were overwhelmingly able to I've learned that you can speed things up.""","""I learned that the concept of remainder is important in programming.""",,,,-3
C-2022-1_U88,"""Computer science formalizes computational methods in order for computers to function efficiently. Algorithms are simple combinations of computations, and programs are those expressed in computer language.""","""I was able to understand terms such as physical approach, CS approach, mathematical formula, algorithm, algorithm, program, and rooted tree. I was able to roughly understand how to reduce the amount of calculation.""",,,,-3
C-2022-1_U89,,,,,"""Today, the second half of the class was a little difficult to understand. I think it's a field I'm not very good at, so I'm going to do a lot of preparation and review. I've heard the word ""algorithm"" before."" However, I didn't know what it meant or how it was used, so I'm glad that this class helped me understand a little bit, and I'm also interested in learning more about computer science. rice field.""",-3
C-2022-1_U9,"""use algorithms for calculations""","""By using an algorithm, comparisons can be made in a much shorter time than a brute force comparison.""",,,"""It was refreshing to find a counterfeit out of 9 coins and realize that it only takes two tries to find the counterfeit.""",-3
C-2022-1_U90,,,,,"""I had heard the word ""algorithm"" a lot, but I didn't know what it meant, so it was refreshing. I thought it was interesting, but also scary, that a slight change in the method could drastically change the calculation time. rice field.""",-3
C-2022-1_U91,"""Computers are made of calculations""","""A computation is an output of an answer given an input""","""I didn't know much about sorting""","""About Sorting""","""I thought the coin comparison count problem was clever""",-3
C-2022-1_U92,"""Algorithm is the process of solving a problem, and Euclid's Algorithm is one of the algorithms.""","""I know what the algorithm is""",,,"""I forgot to do the 2nd to 4th diaries, so I'll try to do it early from now on.""",-3
C-2022-1_U93,"""Algorithms are useful in many fields""","""In order to create an algorithm, the conditions must be clarified""",,,,-3
C-2022-1_U94,"""Everything done on a computer is a calculation. To handle it, you need to know who Kei-san is. The science for that is computer science.""",,"""I didn't understand Colasso Kakutani""",,"""It didn't feel right to say that everything done by a computer was a calculation""",-3
C-2022-1_U96,"""Computer science can be the foundation of all scientific and technological fields. Among them are the physical approach of mathematical formulation that cannot be illuminated, and the CS approach of provable algorithmic formulation. Problems in computation always have an answer."" There is something.A vague thing cannot be calculated.The calculation procedure of a function is called an algorithm.Computation in a computer can be done by combining simple calculations.This combination is called an algorithm.The form of an algorithm in words that a computer can understand is called a program.""","""I learned that the algorithms we use in our daily life are different from those of computers.""","""I didn't quite understand Shinki. I thought it was a y-hull of combinations.""","""I want to know more about Shinki.""","""It was good because I understood the concept of computer calculation well.""",-3
D-2020_U11,"""Sampling and Sampling Theorem, Explanation of Restoration""",,,,,-3
D-2020_U12,"""Sampling allows us to recover the original signal.""",,,,,-3
D-2020_U13,"""I learned about the sampling theorem.""","""I was able to understand the sampling theorem and sampling frequency""",,,,1
D-2020_U14,"""About the Sampling Theorem and Reconstruction
""","""I got a rough idea of ​​sampling theorem and reconstruction""",,,"""I was very curious about the restoration, so it was interesting. I understood what they were saying in class, but it wasn't something I could immediately understand intuitively, so I wanted to deepen my understanding by looking at the formulas.""",0
D-2020_U15,"""About Z transform""","""We found that the Z-transform of a discrete-time signal can be easily calculated.""",,,,1
D-2020_U16,,"""Signal reconstruction methods and their relation to the Fourier transform""",,,,-2
D-2020_U18,"""A continuous-time signal can be converted to a sampled signal by sampling using the sampling theorem.
At that time, when the sampling frequency is equal to or lower than the Nyquist frequency, spectral overlap called aliasing occurs.
To prevent this, an antialiasing filter is provided to remove high frequency components before sampling. """,,,,,1
D-2020_U19,"""I learned basic formulas and theorems about sampling, and also about sampling phenomena such as aliasing.""","""I was able to understand the basic knowledge of sampling""","""I don't know how to find the sampling frequency
Therefore, the Nyquist frequency could not be determined.""",,,0
